,Title,Description,URL,Published At,Category,Image URL
193,Six ways to reduce risk of cognitive decline - KITV,A new report from AARP shows there are ways to reduce your risk of cognitive decline.,https://www.youtube.com/watch?v=brkJcsH6b5o,2023-07-06T03:16:39Z,health,https://i.ytimg.com/vi/brkJcsH6b5o/maxresdefault.jpg
194,COVID-19 strikes harder on low-income communities in LA; Vaccination proves key to reducing disparity - News-Medical.Net,"COVID-19 incidence rates were higher in lower-income communities compared to higher-income communities before vaccines became available in Los Angeles. However, after vaccination, the disparity in COVID-19 incidence diminished, with the lowest-income communit…",https://www.news-medical.net/news/20230705/COVID-19-strikes-harder-on-low-income-communities-in-LA3b-Vaccination-proves-key-to-reducing-disparity.aspx,2023-07-06T02:45:00Z,health,https://d2jx2rerrg6sh3.cloudfront.net/images/news/ImageForNews_752929_16886078619192608.jpg
195,New CRISPR-based system could eliminate malaria-carrying mosquitoes - News-Medical.Net,"Malaria remains one of the world's deadliest diseases. Each year malaria infections result in hundreds of thousands of deaths, with the majority of fatalities occurring in children under five.",https://www.news-medical.net/news/20230705/New-CRISPR-based-system-could-eliminate-malaria-carrying-mosquitoes.aspx,2023-07-06T02:04:00Z,health,https://d2jx2rerrg6sh3.cloudfront.net/image-handler/picture/2014/7/DNA_Genetics-620x480.jpg
196,"Timing, type, and frequency of exercise are crucial components for optimal glycemic control in type 2 diabetes - News-Medical.Net","Exercise plays a crucial role in managing type 2 diabetes, offering potential benefits such as improved glycemic control. This study explores exercise recommendations and their impact on dietary, medication, and behavioral factors for optimal diabetes care.",https://www.news-medical.net/news/20230705/Timing-type-and-frequency-of-exercise-are-crucial-components-for-optimal-glycemic-control-in-type-2-diabetes.aspx,2023-07-06T01:04:00Z,health,https://d2jx2rerrg6sh3.cloudfront.net/images/news/ImageForNews_752814_1688524671208241.jpg
197,High-Dose Vitamin D May Cut Risk for New Atrial Fibrillation - Medscape,"The risk fell by about a third over 4 years in nonvitamin D-deficient older adults who took vitamin D3 at 3200 IU daily, in a post hoc finding from a randomized trial.",https://www.medscape.com/viewarticle/994037,2023-07-05T23:43:27Z,health,https://img.medscape.com/thumbnail_library/gty_221220_vitamin_d_800x450.jpg
198,Study: BMI may not increase mortality independently of other risk factors - News-Medical.Net,"Body mass index (BMI) may not increase mortality independently of other risk factors in adults, according to a new study published this week in the open-access journal PLOS ONE by Aayush Visaria and Soko Setoguchi of Rutgers University, US.",https://www.news-medical.net/news/20230705/Study-BMI-may-not-increase-mortality-independently-of-other-risk-factors.aspx,2023-07-05T22:32:00Z,health,https://d2jx2rerrg6sh3.cloudfront.net/image-handler/picture/2014/7/Body_Mass_Index-620x480.jpg
199,Early Detection and Treatment of Postpartum Hemorrhage | NEJM - nejm.org,,https://www.nejm.org/do/10.1056/NEJMdo007118/full/,2023-07-05T21:15:24Z,health,
200,‘Playgrounds are vaccines against non-communicable diseases’ - Greater Kashmir,"Srinagar: Experts on Wednesday called for a multi-discipline approach to reduce the burden of non-communicable diseases (NCDs), and said that the need of the ho",https://www.greaterkashmir.com/todays-paper/front-page/playgrounds-are-vaccines-against-non-communicable-diseases,2023-07-05T20:15:41Z,health,https://gumlet.assettype.com/greaterkashmir%2Fimport%2F2016%2F01%2F2016_1largeimg222_jan_2016_232034277.jpg?w=1200&auto=format%2Ccompress&ogImage=true&enlarge=true
201,"How structural changes associated with osteoarthritis, finds study - ANI News",,https://www.aninews.in/news/health/how-structural-changes-associated-with-osteoarthritis-finds-study20230705232859,2023-07-05T18:02:13Z,health,
202,"Fibre, balanced with carbs, could hold the key to weight management - Scroll.in",Modern processed grains like white rice and white flour as well as many ultraprocessed foods have removed fibres that are naturally a part of many types of food,https://scroll.in/article/1052041/fibre-balanced-with-carbs-could-hold-the-key-to-weight-management,2023-07-05T18:00:00Z,health,https://s01.sgp1.cdn.digitaloceanspaces.com/book/186447-qmkkubiauf-1675420481.jpg
203,Trained Immunity May Play a Role in the Pathogenesis of Vitiligo - Dermatology Times,Trained immunity may act as an enhancer and continuous trigger in the disease’s pathogenesis.,https://www.dermatologytimes.com/view/trained-immunity-may-play-a-role-in-the-pathogenesis-of-vitiligo,2023-07-05T17:03:27Z,health,https://cdn.sanity.io/images/0vv8moc6/dermatologytimes/63a400c95c2e6ba389e8f495170e693032ecf852-6500x5000.jpg?fit=crop&auto=format
204,"Orange Juice: Benefits, Nutrition, and Risks - Health.com","Orange juice is rich in vitamin C and other compounds that may improve heart health, brain function, and immunity. Learn about the benefits and risks of orange juice.",https://www.health.com/orange-juice-benefits-7553542,2023-07-05T16:15:28Z,health,https://www.health.com/thmb/FBc2wwj342G4uYyWj5gA8LxXLz0=/2121x0/filters:no_upscale():max_bytes(150000):strip_icc()/OrangeJuice-89d67c666c074a4eb6f9cd068c81d291.jpg
205,Diabetic retinopathy diagnoses seen nearing 10M in U.S. - UW Medicine Newsroom,"For the first time, a comprehensive statistical analysis has enabled researchers to estimate the number of Americans of all ages living with diabetic retinopathy, and the number’s not pretty. The study conducted by researchers at the Centers for Disease Contr…",https://newsroom.uw.edu/postscript/diabetic-retinopathy-diagnoses-seen-nearing-10m-us,2023-07-05T15:55:08Z,health,https://newsroom.uw.edu/sites/default/files/styles/social_media_2_1/public/dreyeball.jpg
206,New study investigates whether we think about anxiety and depression differently now - Medical Xpress,"Following COVID, mental health is front and center in the public consciousness.",https://medicalxpress.com/news/2023-07-anxiety-depression-differently.html,2023-07-05T15:39:04Z,health,https://scx2.b-cdn.net/gfx/news/hires/2021/anxiety.jpg
207,Retinopathy of Prematurity Risk Linked to Parenteral Nutrition Duration - AJMC.com Managed Markets Network,Infants who received parenteral nutrition for at least 14 days had a higher risk of retinopathy of prematurity and receiving treatment.,https://www.ajmc.com/view/retinopathy-of-prematurity-risk-linked-to-parenteral-nutrition-duration,2023-07-05T15:33:30Z,health,https://cdn.sanity.io/images/0vv8moc6/ajmc/dd0187d84757193d9d585214cd33123aa371dea1-2000x1455.jpg?fit=crop&auto=format
208,4 Ways to keep your hair from looking oily in monsoon - Mirchi Plus,"While Sebum is necessary for smooth and silky hair, during monsoon y​​our body produces more sebum than needed, resulting in a wet and sticky scalp.",https://mirchi.in/stories/lifestyle/4-ways-to-keep-your-hair-from-looking-oily-in-monsoon/101521734,2023-07-05T14:51:46Z,health,"https://static.mirchi.in/thumb/imgsize-391334,msid-101521734,width-800,height-450,resizemode-1/101521734.jpg"
209,Federal Officials Hatch a Three-Pronged Defense Against Another 'Tripledemic' - News 4 Social English,"Federal Officials Hatch a Three-Pronged Defense Against Another ‘Tripledemic’ To prevent a repeat of last winter’s “tripledemic” of respiratory illnesses,",https://en.news4social.com/business/federal-officials-hatch-a-three-pronged-defense-against-another-tripledemic/,2023-07-05T14:08:36Z,health,
210,Foods To Cleanse Your Liver - TheHealthSite,"High humidity, heat, dehydration, poor diet, excess alcohol consumption can take a toll on the liver and reduce its ability to carry out its functions.",https://www.thehealthsite.com/webstories/fitness/diet/foods-to-cleanse-your-liver-990124/,2023-07-05T13:33:47Z,health,
211,VIDEO: Many pathways to diabetes remission - Healio,"SAN DIEGO &mdash; In this video exclusive, Richard Pratley, MD, discusses diabetes remission and the need for more information and clinical trials to understand the impact of remission on long-term outcomes.Pratley is the Samuel E. Crockett Chair in Diabetes …",https://www.healio.com/news/endocrinology/20230705/video-many-pathways-to-diabetes-remission,2023-07-05T13:04:03Z,health,https://www.healio.com/~/media/slack-news/endocrinology/misc/video-og-images/et0723pratley_ada_ew_video.png
212,Studies offer insights into how the brain processes and stores words we hear - Tech Explorist,Finding has implications for stroke survivors and others with brain disorders.,https://www.techexplorist.com/studies-offer-insights-brain-processes-stores-words-hear/,2023-07-05T12:50:53Z,health,https://www.techexplorist.com/wp-content/uploads/2023/07/human-brain-medical-digital-illustration.jpg
213,One shot of this kidney protein may help fight dementia - mid-day.com,"Produced by the kidney, klotho circulates in the blood and has been linked to health and lifespan. It decreases naturally with age.",https://www.mid-day.com/lifestyle/health-and-fitness/article/one-shot-of-this-kidney-protein-may-help-fight-dementia-23296043,2023-07-05T12:11:00Z,health,https://images.mid-day.com/images/images/2023/jul/Attack-woman-d_d.jpg
214,"Immune response against “bystander” virus, not SARS-CoV-2, may cause long Covid: Study - The Financial Express","Analysing Covid-patients' blood samples, researchers found that 3 months after being hospitalised for severe infection, there was no rapid increase in the immune cells targeting SARS-CoV-2, but an increase in those targeting the dormant Cytomegalovirus (CMV).",https://www.financialexpress.com/healthcare/covid-19/immune-response-against-bystander-virus-not-sars-cov-2-may-cause-long-covid-study/3157439/,2023-07-05T11:59:38Z,health,https://www.financialexpress.com/wp-content/uploads/2023/07/Long-covid.jpg
215,"All about Leqembi, new Alzheimer’s drug that’s likely to get US approval, and its risks - ThePrint",,https://theprint.in/health/all-about-leqembi-new-alzheimers-drug-thats-likely-to-get-us-approval-and-its-risks/1655322/,2023-07-05T11:57:11Z,health,
216,Endometriosis linked to reduction in fertility: Study - Nagaland Post,,https://nagalandpost.com/index.php/endometriosis-linked-to-reduction-in-fertility-study/,2023-07-05T11:50:53Z,health,
217,New blood test to predict preeclampsia earlier in pregnant woman - Nagaland Post,,https://nagalandpost.com/index.php/new-blood-test-to-predict-preeclampsia-earlier-in-pregnant-woman/,2023-07-05T11:48:09Z,health,
218,‘SMART INSULIN’ Developed By IIT Bhilai & SNU Researchers – A Potential Game-Changer in Diabetes Care - BioTecNika,SMART INSULIN Developed By IIT Bhilai & SNU Researchers - A Potential Game-Changer in Diabetes care & Treatment.,https://www.biotecnika.org/2023/07/smart-insulin-by-iit-bhilai-snu-researchers-for-diabetes-care/,2023-07-05T11:11:38Z,health,https://cdn.biotecnika.org/wp-content/uploads/2023/07/Blue-Women-Shoes-Review-Youtube-Thumbnail.jpg
219,Microbes in tumours: Exploring the role of bacteria in cancer growth and treatment - The Week,"Our bodies are home to a wide variety of microbes that can either benefit or harm our health. In recent years, scientists have made a surprising discovery: microbes, including bacteria and fungi, can be found living inside tumours. This revelation has sparked…",https://www.theweek.in/news/health/2023/07/05/microbes-in-tumors-exploring-the-role-of-bacteria-in-cancer-grow.html,2023-07-05T10:34:00Z,health,https://www.theweek.in/content/dam/week/news/2022/images/2023/2/human-cancer-cell-shut.jpg
220,Summertime Sadness: Signs you might be having summer seasonal depression and what causes it - Indiatimes.com,"Summer can bring joy to many, but for some, it triggers seasonal affective disorder (SAD). Unlike its winter counterpart, summer depression manifests differently. Symptoms include decreased appetite, insomnia, and agitation.  Heat, humidity, and pollen contri…",https://timesofindia.indiatimes.com/life-style/health-fitness/health-news/summertime-sadness-signs-you-might-be-having-summer-seasonal-depression-and-what-causes-it/photostory/101515024.cms,2023-07-05T10:30:00Z,health,https://static.toiimg.com/photo/101515098.cms
221,Successful Aging: Tips for Keeping Your Body and Mind Sharp - Health Essentials,"People in the U.S. are living longer than ever. And we all want to spend those years living a full life, rather than just managing chronic disease. Check out these tips that can help ensure your older years are some of your healthiest.",https://health.clevelandclinic.org/aging-successfully/,2023-07-05T10:25:28Z,health,https://health.clevelandclinic.org/wp-content/uploads/sites/3/2023/06/elder-Man-Laughs-friends-1368003421-770x533-1.jpg
222,10 weight-loss tips for women over 40 - Moneycontrol,"Weight loss tips: Weight loss for women over 40 requires a multifaceted approach that encompasses healthy eating, regular exercise, stress management, and lifestyle adjustments.",https://www.moneycontrol.com/news/health-and-fitness/10-weight-loss-tips-for-women-over-40-10909301.html,2023-07-05T10:12:37Z,health,https://images.moneycontrol.com/static-mcnews/2023/04/Weight-loss-tips-770x433.jpg
223,Health dept on alert as Dengue cases rise in Coimbatore - DTNEXT,The Southwest monsoon that gives good rains to Coimbatore which is a bordering district to Palakkad district in Kerala has also not gained momentum.,https://www.dtnext.in/news/tamilnadu/health-dept-on-alert-as-dengue-cases-rise-in-coimbatore-722366,2023-07-05T09:09:33Z,health,https://dtnext-prod.s3.ap-south-1.amazonaws.com/h-upload/2023/07/05/746309-dengue.jpg
224,Endometriosis-Associated Pain - PracticalPainManagement.com,"Management of chronic pelvic pain due to endometriosis can be complex. Clinicians across specialties need to understand the condition’s multifaceted, complicated nature to help patients find relief.",https://www.practicalpainmanagement.com/pain/other/abdominal-pelvis/endometriosis-pain,2023-07-05T09:00:00Z,health,https://images.ctfassets.net/59984t4qg9dz/S979Cm8kP0ZxAUWM7sdqJ/618cac08dfccb72c1c3cb4b04d2d97a9/GettyImages-1461330639-3000x2000.jpg
225,Researchers suggest antibiotic regimen for newborns - Awaz The Voice,Gentamicin is a commonly used antibiotic in the treatment of severely unwell newborns It is water soluble and is mostly excreted from the body through the urine As a result total body weight which includes the weight of the body s water content is utilised to…,https://www.awazthevoice.in/health-news/researchers-suggest-antibiotic-regimen-for-newborns-22452.html,2023-07-05T08:53:22Z,health,https://www.awazthevoice.in/upload/news/1688547202pexels-photo.webp
226,5 symptoms of glucose spike in people with diabetes - msnNOW,,https://www.msn.com/en-in/money/technology/5-symptoms-of-glucose-spike-in-people-with-diabetes/ar-AA1drSDQ,2023-07-05T08:30:00Z,health,
227,Trenorol Review - Is CrazyBulk USA Legal Trenbolone Steroid Alternative Worth Your Money? - Republic World,"Trenorol offers a set of beneficial androgenic properties complemented by compelling, lawful, and risk-free endorsements.",https://www.republicworld.com/lifestyle/health/trenorol-review-is-crazybulk-usa-legal-trenbolone-steroid-alternative-worth-your-money-articleshow.html,2023-07-05T08:08:00Z,health,https://img.republicworld.com/republic-prod/stories/promolarge/xhdpi/zltvw2dmrjp8goo6_1688535554.jpeg
228,Joint Research Finds Flu Pandemics Are Followed By Recurrent Outbreaks For Around Two Decades - India Education Diary,"Influenza pandemics cause a persistent increase in influenza mortality risk, lasting around two decades, according to new research analysing historical data from the 19th and 20th centuries.A new study – led by researchers at the University of Glasgo",https://indiaeducationdiary.in/joint-research-finds-flu-pandemics-are-followed-by-recurrent-outbreaks-for-around-two-decades/,2023-07-05T08:07:06Z,health,https://indiaeducationdiary.in/wp-content/uploads/2023/07/flu-image-websize-638218999021773690.jpg
229,"Does Meal Timing Matter? Eating At Night May Boost Endurance, Study Suggests - Medical Daily",The latest study shows that restricting food intake during the active cycle – when individuals are most active and alert – offers health benefits such as weight loss and improved blood sugar control in mice.,https://www.medicaldaily.com/does-meal-timing-matter-eating-night-may-boost-endurance-study-suggests-470417,2023-07-05T08:02:19Z,health,https://d.medicaldaily.com/en/full/466586/running-together.png
230,8 Yoga Poses that can make you thin in 1 week - True Scoop,It's important to note that yoga alone cannot guarantee weight loss in a specific timeframe,https://www.truescoopnews.com/stories/yoga-poses-can-make-thin-week,2023-07-05T07:45:06Z,health,https://tsncdn.azureedge.net/newsimagesfull/webstory_20230705073945_1.jpg
231,"Spread of Antibiotic Resistant Genes Among Bacteria Can be Restricted With Proper Sanitation and Water Facilities, Finds Study - NewsClick","A major global public health concern is the rise of antibiotic resistance amongst bacteria, study highlights the role of environmental transmission of antibiotic resistance in settings with inadequate sanitation.",https://www.newsclick.in/spread-antibiotic-resistant-genes-among-bacteria-can-be-restricted-proper-sanitation-and-water,2023-07-05T06:46:33Z,health,https://www.newsclick.in/sites/default/files/2023-07/drinking%20water.jpg
232,Not brushing teeth at night? Study finds it may increase your risk of cardiovascular disease - News9 LIVE,Researchers looked at individuals who are 20 years of age and older to see if how frequently they brushed their teeth affected their risk of cardiovascular diseases (CVDs). Check details here,https://www.news9live.com/health/health-conditions/not-brushing-teeth-at-night-study-finds-it-may-increase-your-risk-of-cardiovascular-disease-2201708,2023-07-05T05:45:55Z,health,https://images.news9live.com/wp-content/uploads/2023/07/front-view-man-brushing-his-teeth-1-1.jpg
233,ECG Readings Can Diagnose Heart Attacks More Accurately: Study - BW Healthcareworld,"News and Updates for Healthcare in India - , Healthcare Service Providers-The researchers compared their model to three gold standards for assessing cardiac events: experienced clinician interpretation of ECG, commercial ECG algorithms and the HEART score, wh…",https://bwhealthcareworld.businessworld.in/article/ECG-Readings-Can-Diagnose-Heart-Attacks-More-Accurately-Study-/05-07-2023-483000,2023-07-05T05:42:57Z,health,https://static.businessworld.in/article/article_large_image/1622895965_wwNcjp_Cardiac_Arrest.jpg
234,Diabetes treatment & drugs that could make you throw your weight around - Indiatimes.com,"At the recently concluded American Diabetic Association (ADA) meeting in San Diego last week, the focus of treatment of this omnipresent and increasin",https://timesofindia.indiatimes.com/city/mumbai/diabetes-treatment-drugs-that-could-make-you-throw-your-weight-around/articleshow/101502436.cms,2023-07-05T03:32:00Z,health,"https://static.toiimg.com/thumb/msid-101502706,width-1070,height-580,imgsize-22628,resizemode-75,overlay-toi_sw,pt-32,y_pad-40/photo.jpg"
235,"Polycystic ovary syndrome: Manage PCOS symptoms with weight loss, exercise and diet tips - Moneycontrol","Polycystic Ovary Syndrome: Here's everything you need to know about the symptoms, causes, and potential risks of Polycystic Ovary Syndrome (PCOS). Follow these weight loss, exercise and healthy diet tips to manage this condition effectively.",https://www.moneycontrol.com/news/health-and-fitness/polycystic-ovary-syndrome-manage-pcos-symptoms-with-easy-weight-loss-exercise-and-diet-tips-10905841.html,2023-07-05T03:25:59Z,health,https://images.moneycontrol.com/static-mcnews/2023/07/Causes-symptoms-and-cure-for-PCOS-770x433.jpg
236,Astaxanthin: The carotenoid you should know - Mint Lounge,The ‘King of Carotenoids’ is becoming a buzzword thanks to its innumerable benefits,https://lifestyle.livemint.com/health/wellness/astaxanthin-king-of-carotenoids-antioxidant-111688484387027.html,2023-07-05T02:38:05Z,health,https://images.livemint.com/img/2023/07/04/1140x641/abstral-official-Pwcn31davYQ-unsplash_1688484485382_1688484502615.jpg
237,Gluten-free diet next big health trend - Telangana Today,This diet is followed by people for managing signs and symptoms of celiac disease,https://telanganatoday.com/gluten-free-diet-next-big-health-trend,2023-07-05T02:10:38Z,health,https://cdn.telanganatoday.com/wp-content/uploads/2022/02/cropped-android-chrome-512x512-1-267x267-2.png
238,Mysterious brain illness in Canada: Dementia-like symptoms reported in young people - The Financial Express,"Meanwhile, some experts claim that the illness may be linked to the use of pesticides in the primarily rural province.",https://www.financialexpress.com/healthcare/news-healthcare/mysterious-brain-illness-in-canada-dementia-like-symptoms-reported-in-young-people/3155230/,2023-07-05T01:30:00Z,health,https://www.financialexpress.com/wp-content/uploads/2023/02/x-ray-g55f6a41a3_1920.jpg
239,Cervical cancer High prevalence of high‐risk HPV in younger women: Study - DTNEXT,"The experts also highlighted the need for a national, government-sponsored public health policy in South India, and the implementation of a high throughput technology for cervical cancer that is...",https://www.dtnext.in/news/city/cervical-cancer-high-prevalence-of-highrisk-hpv-in-younger-women-study-722270,2023-07-05T00:30:41Z,health,https://dtnext-prod.s3.ap-south-1.amazonaws.com/h-upload/2023/07/04/746196-720-2023-07-05t011314829.jpg
240,"Resistance training: A promising measure to prevent, delay Alzheimer`s - WION","Resistance training: A promising measure to prevent, delay Alzheimers",https://www.wionews.com/science/resistance-training-a-promising-measure-to-prevent-delay-alzheimers-612029,2023-07-04T23:04:52Z,health,http://cdn.wionews.com/sites/default/files/2023/07/05/364520-alzheimers.jpg
241,"Ozempic in a pill: Could higher doses improve blood sugar, weight loss? - Medical News Today","Higher doses of oral semaglutide may effectively be able to control blood sugar and help weight loss, according to a new study.",https://www.medicalnewstoday.com/articles/ozempic-in-pill-could-higher-doses-improve-blood-sugar-weight-loss,2023-07-04T14:21:56Z,health,https://post.medicalnewstoday.com/wp-content/uploads/sites/3/2023/07/Ozempic_pill_GettyImages1404570793_Thumb.jpg
242,Salt content: Are you keeping a check? - Indiatimes.com,Increased amounts of sodium chloride can be harmful to your body and according to studies Indian consume double the amount of salt recommended by WHO.,https://timesofindia.indiatimes.com/life-style/health-fitness/diet/salt-content-are-you-keeping-a-check/articleshow/101483870.cms,2023-07-04T14:10:00Z,health,"https://static.toiimg.com/thumb/msid-101483996,width-1070,height-580,imgsize-18754,resizemode-75,overlay-toi_sw,pt-32,y_pad-40/photo.jpg"
243,First Month Of Pregnancy: A Complete Diet And Exercise Guide For Expecting Mothers - HerZindagi English,"The first month of the pregnancy is all about taking baby steps towards building your health, eating right, and resting plenty. Here is your guide to what to eat and which exercise to perform.",https://www.herzindagi.com/advice/first-month-pregnancy-guide-for-expecting-mothers-article-236560,2023-07-04T12:50:06Z,health,https://images.herzindagi.info/image/2023/Jul/first-month-pregnancy-diet-and-exercise.jpg
244,10 foods that have more magnesium than pumpkin seeds - Recipes,"While roasted pumpkin seeds are indeed a good source of magnesium, there are several other foods that contain even higher levels of this essential mineral. Here are 10 foods that have more magnesium than pumpkin seeds.",https://recipes.timesofindia.com/web-stories/10-foods-that-have-more-magnesium-than-pumpkin-seeds/photostory/101487060.cms,2023-07-04T12:30:00Z,health,"https://static.toiimg.com/thumb/msid-101487138,imgsize-224520,width-900,height-1200,resizemode-6/101487138.jpg"
245,Legs Up The Wall Pose (Viparita Karani): How To Practice Benefits And Precautions | TheHealthSite.com - TheHealthSite,More Viparita Karani advantages may be obtained by doing this yoga pose between two meals which should be at least five hours apart. TheHealthSite.com,https://www.thehealthsite.com/yoga/legs-up-the-wall-pose-viparita-karani-how-to-practice-benefits-and-precautions-989764/,2023-07-04T11:33:00Z,health,https://st1.thehealthsite.com/wp-content/uploads/2023/07/WhatsApp-Image-2023-07-04-at-12.25.52.jpg
246,Why are kids dying of heart diseases? Here are key questions answered by doctors - msnNOW,,https://www.msn.com/en-in/health/health-news/why-are-kids-dying-of-heart-diseases-here-are-key-questions-answered-by-doctors/ar-AA1doCul?ocid=StaticFallback,2023-07-04T11:11:00Z,health,
247,Malaria cases in Florida and Texas: What’s keeping the US from being a malaria hotspot? - Vox.com,Americans shouldn’t take a malaria-free future for granted.,https://www.vox.com/2023/7/4/23778786/malaria-us-florida-texas-climate-change-travel-resurgence-comeback,2023-07-04T11:00:00Z,health,https://cdn.vox-cdn.com/thumbor/JVrMOLrrJpdGlvTdZjQNHG3awr8=/0x215:3000x1786/fit-in/1200x630/cdn.vox-cdn.com/uploads/chorus_asset/file/24762549/594886104.jpg
