,Title,Description,URL,Published At,Category,Image URL
304,One shot of this kidney protein may help fight dementia - Investing.com India,"The Financial News section features stock market news in addition to stories about bonds, forex, commodities and economic releases.",https://in.investing.com/news/one-shot-of-this-kidney-protein-may-help-fight-dementia-3710668,2023-07-04T14:20:55Z,science,https://i-invdn-com.investing.com/news/https://i-invdn-com.investing.com/akapi-images/800x450/9dad1ee353d5b697a33108fed4dcda28_w_800_h_450.jpg
305,उड़न उड़न - The Free Media - The Free Media,,https://thefreemedia.in/%E0%A4%89%E0%A4%A1-%E0%A4%A8-%E0%A4%89%E0%A4%A1-%E0%A4%A8/,2023-07-04T13:37:29Z,science,
306,Research Uses Low Sample Volumes To Better Understand Brain Diseases - India Education Diary,"Marlien van Mever delved into the analysis of tiny samples, cerebrospinal fluid from transgenic mouse models for example. She validated methods that can now be used to study brain diseases such as migraine and epilepsy. Van Mever will receive her PhD",https://indiaeducationdiary.in/research-uses-low-sample-volumes-to-better-understand-brain-diseases/,2023-07-04T13:33:57Z,science,https://indiaeducationdiary.in/wp-content/uploads/2021/03/Leiden-University-1024x452.png
307,Leiden University doctoral candidate finds thin atmosphere on exoplanet TRAPPIST-1 c with JWST - India Education Diary,A group of astronomers led by Leiden PhD student Sebastian Zieba has discovered using the James Webb Space Telescope (JWST) that the rocky exoplanet TRAPPIST-1 c has a thin atmosphere. Although the planet is nearly identical to Venus in size and temp,https://indiaeducationdiary.in/leiden-university-doctoral-candidate-finds-thin-atmosphere-on-exoplanet-trappist-1-c-with-jwst/,2023-07-04T13:22:28Z,science,https://indiaeducationdiary.in/wp-content/uploads/2021/03/Leiden-University-1024x452.png
308,Method Developed To Find Majorana’s Tested For The First Time - India Education Diary,"Fifteen years ago, an alternative technique to look for the elusive Majorana particles was conceived theoretically. But no one carried out the experiment, until now. Physicist Jianfeng Ge and his colleagues from the Allan lab of the Leiden Institute",https://indiaeducationdiary.in/method-developed-to-find-majoranas-tested-for-the-first-time/,2023-07-04T13:07:10Z,science,https://indiaeducationdiary.in/wp-content/uploads/2021/03/Leiden-University-1024x452.png
309,From the archives: NASA's Mars Pathfinder space probe lands on Mars - CBS Evening News,"The Mars Pathfinder landed on the Red Planet on July 4, 1997, transmitting data back to NASA through Sept. 27, 1997.#news #space #mars ""CBS Evening News with...",https://www.youtube.com/watch?v=MtikpuGLgVE,2023-07-04T13:00:12Z,science,https://i.ytimg.com/vi/MtikpuGLgVE/maxresdefault.jpg
310,Do you know molecular switch controls lipid metabolism? Study finds - Dynamite News,A team of researchers from the University of Basel in Switzerland uncovered a molecular switch that controls lipid metabolism in human cells. This switch regulates lipid storage or conversion into energy. Read further on Dynamite News:,https://www.dynamitenews.com/story/do-you-know-molecular-switch-controls-lipid-metabolism-study-finds,2023-07-04T12:48:56Z,science,https://www.dynamitenews.com/images/2023/07/04/do-you-know-molecular-switch-controls-lipid-metabolism-study-finds/64a414abba57e.jpg
311,"Early Human Ancestors Walked the Earth Alongside Dinosaurs, Study Reveals - The Weather Channel","Using a dataset representing 380 placental mammal families, the researchers calculated that about 21.3% of them could have mingled with dinosaurs in the Cretaceous period.",https://weather.com/en-IN/india/science/news/2023-07-04-early-human-ancestors-walked-the-earth-alongside-dinosaurs-study,2023-07-04T12:33:02Z,science,https://s.w-x.co/in-dino_0.jpg
312,"Extreme diets Cannibalism, or clickbait for paleoanthropology - DTNEXT","Everybody’s quick to see a cannibal. The Romans thought the ancient Britons feasted on human flesh, and the British thought the same about the Irish. Not a few prehistoric finds have been...",https://www.dtnext.in/edit/extreme-diets-cannibalism-or-clickbait-for-paleoanthropology-722048,2023-07-04T12:30:25Z,science,https://dtnext-prod.s3.ap-south-1.amazonaws.com/agency_feeds/DT/2023/07/03/745822-19445769815278955.jpg
313,NL: Three Wageningen scientists receive Vidi grant - Vertical Farm Daily,"Three scientists of Wageningen University & Research are to receive a Vidi grant of up to 800,000 euros. The funds can be put towards developing an innovative research tract and expanding…",https://www.verticalfarmdaily.com/article/9543023/nl-three-wageningen-scientists-receive-vidi-grant/,2023-07-04T12:27:50Z,science,https://www.verticalfarmdaily.com/remote/https/agfstorage.blob.core.windows.net/misc/HD_com/2023/07/04/c33b6b42_0319_4b83_bc3f_455d392377e9_shutterstock_2167363573_4bfee56e_G0B3S.jpg?preset=OgImage
314,FSU researchers unveil new model for chemical garden growth - Tech Explorist,Modeling chemical garden growth in 2 and 3 dimensions.,https://www.techexplorist.com/fsu-researchers-unveil-new-model-chemical-garden-growth/,2023-07-04T11:57:21Z,science,https://www.techexplorist.com/wp-content/uploads/2023/07/steinbock-cells.jpg
315,"Thin film improves ""usable light"" needed to grow microalgae on industrial scales - Advanced Science News - Advanced Science News","A textured film maximizes sunlight by generating an increased amount of red light, reducing the costs of algae production on a significant scale.",https://www.advancedsciencenews.com/thin-film-improves-usable-light-needed-to-grow-microalgae-on-industrial-scales/,2023-07-04T11:48:34Z,science,https://www.advancedsciencenews.com/wp-content/uploads/2023/07/waterly-blue-bubbles-acrylic-painting.jpg
316,Astronomers discover dramatic black hole switch-on - Tech Explorist,New research expands understanding of supermassive black holes' capabilities.,https://www.techexplorist.com/astronomers-discover-dramatic-black-hole-switch-on/,2023-07-04T11:30:41Z,science,https://www.techexplorist.com/wp-content/uploads/2023/07/black-hole.jpg
317,Researchers develop deep learning model for predicting CRISPR tool activity - Tech Explorist,CRISPR and AI accurately control gene expression.,https://www.techexplorist.com/researchers-develop-deep-learning-model-predicting-crispr-tool-activity/,2023-07-04T10:15:27Z,science,https://www.techexplorist.com/wp-content/uploads/2023/07/CRSPR.jpg
318,"Virat Kohli Adds New Shot To Armoury, Tests Reverse Sweep vs Ravichandran Ashwin. Watch | Cricket News - NDTV Sports",Indian batting icon Virat Kohli was spotted practicing reverse sweep shots against Ravichandran Ashwin in the nets ahead of the start of the West Indies Test series.,https://sports.ndtv.com/india-vs-west-indies-2023/virat-kohli-adds-new-weapon-to-armoury-tests-reverse-sweep-vs-ravichandran-ashwin-watch-4179247,2023-07-06T08:53:19Z,sports,https://c.ndtvimg.com/2023-07/5brh1nno_virat-kohli_650x300_05_July_23.jpg
319,"ENG vs AUS Dream11 Prediction, Fantasy Cricket Tips, Playing XI, Pitch Report, & Injury Updates for Ashes, 3rd Test - CricTracker","ENG vs AUS Dream11 Team Prediction Ashes 2023- Read to find out England vs Australia Dream11 Team Today, playing11, Ashes fantasy cricket tips, and more updates for the 3rd Test on CricTracker.",https://www.crictracker.com/fantasy-cricket-tips/dream11-eng-vs-aus-dream11-prediction-playing-xi-fantasy-cricket-tips-pitch-report-injury-updates-for-3rd-test-of-ashes-2023/,2023-07-06T08:30:00Z,sports,https://media.crictracker.com/media/attachments/1669780492120_England-Test-team.jpeg
320,Tamim Iqbal announces shock retirement ahead of CWC23 - ICC Cricket,"Bangladesh have been dealt a major blow ahead of the upcoming ICC Men's Cricket World Cup in India, with skipper Tamim Iqbal deciding to retire from international cricket.",https://www.icc-cricket.com/news/3571400,2023-07-06T07:56:10Z,sports,https://resources.pulse.icc-cricket.com/ICC/photo/2023/07/06/e32696e9-36dd-41c7-ab16-936e38baf993/GettyImages-1247668591.jpg
321,"Watch: Oil Protestor Interrupts Match At Wimbledon, Gets Dragged Off Court By Officials - NDTV Sports","Climate activists interrupted matches at Wimbledon on Wednesday, scattering orange confetti and jigsaw pieces in the latest protests targeting major sporting events",https://sports.ndtv.com/wimbledon-2023/oil-protestor-interrupts-match-at-wimbledon-gets-dragged-off-court-by-officials-watch-4182125,2023-07-06T07:12:57Z,sports,https://c.ndtvimg.com/2023-07/8pip56r_oil-protestor-interrupts-match-at-wimbledon-1200_625x300_06_July_23.jpg
322,"""Bad Days..."": KKR Star Shares Cryptic Post As BCCI Announce Squad For WI T20Is - NDTV Sports",A number of IPL performers were snubbed by the BCCI as the Indian squad for the West Indies T20Is was announced.,https://sports.ndtv.com/west-indies-vs-india-2023/bad-days-build-snubbed-for-west-indies-t20is-kkr-star-posted-this-4181888,2023-07-06T05:55:00Z,sports,"https://c.ndtvimg.com/2023-07/kmgd8hko_nitish-rana-and-rinku-singh-bcci_625x300_06_July_23.jpg?im=FitAndFill,algorithm=dnn,width=1200,height=675"
323,"Who Is India`s Richest Cricketer With Net Worth Of Rs 20,000 Crore And It`s Not Virat Kohli Or MS Dhoni Or... - Zee News",Cricket fans around the world believe that Indian legends Sachin Tendulkar or Mahendra Singh Dhoni or former India captain Virat Kohli must be the richest cricket from India. But they can’t be further than the truth as a former first-class cricketer from Baro…,https://zeenews.india.com/cricket/who-is-india-s-richest-cricketer-with-net-worth-of-rs-20000-crore-and-it-s-not-virat-kohli-or-ms-dhoni-or-sachin-tendulkar-samarjitsinh-ranjitsingh-gaekwad-2631496.html,2023-07-06T05:37:54Z,sports,https://english.cdn.zeenews.com/sites/default/files/2023/07/06/1234847-gaekwadcricketers.jpg
324,"PV Sindhu, Lakshya Sen cruise into second round of Canada Open, Sai Praneeth bow out - mid-day.com",Canada Open: Both PV Sindhu and Lakshya Sen on Wednesday registered straight-game wins over their respective rivals in the BWF World Tour Super 500 event,https://www.mid-day.com/sports/other-sports/article/canada-open-pv-sindhu-lakshya-sen-cruise-into-second-round-sai-praneeth-bow-out-23296244,2023-07-06T04:58:00Z,sports,https://images.mid-day.com/images/images/2023/jul/lakspv_d.jpg
325,"2023 World Cup: Shaheen Shah Afridi wants Pakistan to focus on whole tournament, not just India clash - Indiatimes.com",Cricket News: India will host Pakistan's cricket team for the first time in seven years in the 50-over World Cup in October. The most-awaited clash between rivals I,https://timesofindia.indiatimes.com/sports/cricket/icc-world-cup/2023-world-cup-shaheen-shah-afridi-wants-pakistan-to-focus-on-whole-tournament-not-just-india-clash/articleshow/101533190.cms,2023-07-06T04:54:00Z,sports,"https://static.toiimg.com/thumb/msid-101533094,width-1070,height-580,imgsize-41984,resizemode-75,overlay-toi_sw,pt-32,y_pad-40/photo.jpg"
326,Match-winners: Six players set to decide crunch clash at Cricket World Cup Qualifier - ICC Women's World Cup,Scotland and Netherlands will meet in a do-or-die battle to decide which team claims the last remaining spot at the Cricket World Cup with six key players set to be critical to their hopes.,https://www.cricketworldcup.com/news/3571324,2023-07-06T04:43:54Z,sports,https://resources.pulse.icc-cricket.com/ICC/photo/2023/07/06/133238a1-75b1-4644-ab05-6b71043f3816/Scott-Edwards-and-Logan-van-Beek-of-the-Netherlands-celebrate-following-the-ICC-Men-s-Cricket-World-Cup-Qualifier.jpg
327,Shikhar Dhawan And Bhuvneshwar Kumar's International Career Finished As India Squad For ICC World Cup 2023 Finalized - Cricket Addictor,Shikhar Dhawan And Bhuvneshwar Kumar's International Career Finished As India Squad For ICC World Cup 2023 Finalized,https://cricketaddictor.com/cricket/shikhar-dhawan-and-bhuvneshwar-kumars-international-career-finished-as-india-squad-for-icc-world-cup-2023-finalized/,2023-07-06T04:31:19Z,sports,https://cricketaddictor.com/wp-content/uploads/2021/07/Shikhar-Dhawan-and-Bhuvneshwar-Kumar.jpg
328,"Duleep Trophy Highlights Semifinals Day 1: West Zone ends Day 1 on 216/8; South Zone 63/4, trails by 135 - Sportstar",,https://sportstar.thehindu.com/cricket/duleep-trophy-2023-live-score-semifinals-day-1-highlights-streaming-info/article67043112.ece,2023-07-06T04:06:31Z,sports,
329,"'Luck Went India's Way, No One Was Impressive': West Indies Great On 1983 World Cup Final - NDTV Sports","The Kapil Dev-led side defeated West Indies not once, but twice during the World Cup in 1983.",https://sports.ndtv.com/cricket/luck-went-indias-way-no-one-was-impressive-west-indies-great-on-1983-world-cup-final-4180150,2023-07-06T03:56:01Z,sports,"https://c.ndtvimg.com/2022-06/k1dge13o_kapil-dev-1983-twitter_625x300_25_June_22.jpg?im=FeatureCrop,algorithm=dnn,width=1200,height=675"
330,Viral video: Slap Kabaddi from Pakistan leaves netizens in splits - Indiatimes.com,Trending News: Viral video shows Kabaddi players relentlessly slapping each other.,https://timesofindia.indiatimes.com/etimes/trending/viral-video-slap-kabaddi-from-pakistan-leaves-netizens-in-splits/articleshow/101522162.cms,2023-07-06T03:30:00Z,sports,"https://static.toiimg.com/thumb/msid-101522156,width-1070,height-580,imgsize-237256,resizemode-6,overlay-toi_sw,pt-32,y_pad-40/photo.jpg"
331,"Yashasvi Jaiswal To Sai Sudharsan: IPL 2023 Stars Who Have Earned Call-Up To Indian Teams, In PICS - Zee News",,https://zeenews.india.com/photos/sports/yashasvi-jaiswal-to-sai-sudharsan-ipl-2023-stars-who-have-earned-call-up-to-indian-teams-in-pics-2631426,2023-07-06T03:01:00Z,sports,https://english.cdn.zeenews.com/sites/default/files/2023/07/06/1234708-galleryyashasvitilaklead.jpg
332,"""Would You Do It Again?"" Pat Cummins Asked About Jonny Bairstow Dismissal. Reply Is... - NDTV Sports",The second Ashes Test between England and Australia grabbed the limelight because of the infamous dismissal of Jonny Bairstow by wicketkeeper Alex Carey.,https://sports.ndtv.com/ashes-2023/would-you-do-it-again-pat-cummins-asked-on-jonny-bairstow-dismissal-reply-is-4181377,2023-07-06T02:37:00Z,sports,"https://c.ndtvimg.com/2023-07/dm4crr9g_cummins-afp_625x300_06_July_23.jpg?im=FitAndFill,algorithm=dnn,width=1200,height=675"
333,Novak Djokovic celebrates 350th Grand Slam win as climate protesters disrupt rain-hit Wimbledon - Indiatimes.com,Tennis News: Climate change protesters and yet more rain snagged Wimbledon on Wednesday but while security and scheduling headaches intensified for the organisers,https://timesofindia.indiatimes.com/sports/tennis/wimbledon-2023/novak-djokovic-celebrates-350th-grand-slam-win-as-climate-protesters-disrupt-rain-hit-wimbledon/articleshow/101529094.cms,2023-07-06T02:36:00Z,sports,"https://static.toiimg.com/thumb/msid-101529161,width-1070,height-580,imgsize-32076,resizemode-75,overlay-toi_sw,pt-32,y_pad-40/photo.jpg"
334,"Scouting Report: Arda Güler, the Turkish wonderkid who is set to join Real Madrid - Managing Madrid",Arda Güler is one of the most exciting young talents in world football. The 18-year-old attacking midfielder has been dazzling fans and pundits alike with his performances for Fenerbahçe and...,https://www.managingmadrid.com/2023/7/6/23785300/scouting-report-arda-guler-the-turkish-wonderkid-who-is-set-to-join-real-madrid,2023-07-06T02:11:38Z,sports,https://cdn.vox-cdn.com/thumbor/0UVEjah30iozYOPXoiZctmhOFdo=/0x0:3408x1784/fit-in/1200x630/cdn.vox-cdn.com/uploads/chorus_asset/file/24772357/1516055975.jpg
335,Towhid Hridoy bullish about Bangladesh's bouncebackability | Cricbuzz.com - Cricbuzz - Cricbuzz,The batter feels the series can still be won if Bangladesh avoid silly mistakes like the ones they committed in the opener,https://www.cricbuzz.com/cricket-news/127063/towhid-hridoy-bullish-about-bangladeshs-bouncebackability,2023-07-06T01:26:27Z,sports,http://www.cricbuzz.com/a/img/v1/600x400/i1/c334420/bangladesh-lost-the-series-ope.jpg
336,Transfer Talk: Inter Miami close in on third Barca legend - ESPN - ESPN India,"Inter Miami's pursuit of Jordi Alba appears to be gaining momentum, according to reports. Transfer Talk has the latest.",https://www.espn.in/football/story/_/id/37966242/transfer-talk-inter-miami-close-third-barcelona-legend,2023-07-06T00:51:00Z,sports,https://a2.espncdn.com/combiner/i?img=%2Fphoto%2F2019%2F0121%2Fr491852_1296x729_16%2D9.jpg
337,New finals structure revealed as BBL|13 schedule unveiled - cricket.com.au,"Cricket Australia unveil schedule for shortened men's Big Bash season which includes a new four-team, four-game finals structure for BBL|13",https://www.cricket.com.au/news/bbl-13-schedule-revealed-new-big-bash-league-finals-structure-four-teams/2023-07-06,2023-07-06T00:01:31Z,sports,https://www.cricket.com.au/~/-/media/News/2023/07/6scorchers.ashx?w=1600
338,Carlos Alcaraz Not Playing Thursday At Wimbledon - ATP Tour,Alcaraz Not Playing Thursday At Wimbledon,https://www.atptour.com/en/news/alcaraz-wimbledon-2023-second-round-delayed,2023-07-05T23:43:43Z,sports,https://www.atptour.com/-/media/images/news/2023/07/05/23/12/alcaraz-wimbledon-2023-r2-delayed.jpg
339,Inter Milan sporting director turns down Manchester United’s €45m bid for Andre Onana - Man Utd News,Inter Milan sporting director Piero Ausilio has warned Manchester United that they must increase their offer for Andre Onana if they want to sign him. The Red Devils have put in the first bid worth €45 million but Inter value Onana at €60m. Ausilio has told U…,https://manutdnews.com/inter-milan-sporting-director-turns-down-manchester-uniteds-e45m-bid-for-andre-onana/,2023-07-05T22:55:05Z,sports,https://manutdnews.com/wp-content/uploads/2023/06/fbl-eur-c1-man-city-inter-1-1000x600.jpg
340,Novak Djokovic: ‘You’re Only As Old As You Feel’ - ATP Tour,,https://www.atptour.com/en/news/djokovic-wimbledon-2023-wednesday-reaction,2023-07-05T22:34:46Z,sports,
341,Fabrizio Romano confirms Kylian Mbappe to Real Madrid news - The Real Champs,"The situation of Kylian Mbappe is something that Real Madrid will be keeping a close eye on. The Frenchman does not want to extend his contract with PSG, w...",https://therealchamps.com/2023/07/05/fabrizio-kylian-mbappe-real-madrid-news/,2023-07-05T21:46:00Z,sports,"https://images2.minutemediacdn.com/image/fetch/w_2000,h_2000,c_fit/https%3A%2F%2Ftherealchamps.com%2Fwp-content%2Fuploads%2Fgetty-images%2F2017%2F07%2F1453284988.jpeg"
342,Luis Enrique Drops Surprising Statement About Neymar’s Future at PSG - PSG Talk,Newly appointed manager Luis Enrique spoke about the future of Neymar Jr. during his introductory press conference with the French media Wednesday.,https://psgtalk.com/2023/07/luis-enrique-drops-surprising-statement-about-neymars-future-at-psg/,2023-07-05T21:33:06Z,sports,https://icdn.psgtalk.com/wp-content/uploads/2023/02/Neymar-Monaco-vs-PSG-Ligue-1-2023.jpg
343,Recent Match Report - ENG WMN vs AUS WMN 2nd T20I 2023 - ESPNcricinfo,Ellyse Perry's unbeaten half-century in vain as spinners share five wickets after Wyatt's 76 to give England two points,https://www.espncricinfo.com/series/women-s-ashes-2023-1336063/england-women-vs-australia-women-2nd-t20i-1336075/match-report,2023-07-05T21:03:12Z,sports,https://img1.hscicdn.com/image/upload/f_auto/lsci/db/PICTURES/CMS/363400/363443.6.jpg
344,Close Scoring Thriller! | Highlights - England v Australia | 2nd Women's Vitality IT20 2023 - England & Wales Cricket Board,Go to ecb.co.uk to join We Are England Cricket Supporters for free and get priority access to tickets and much more!Watch match highlights from the 1st of th...,https://www.youtube.com/watch?v=YzVTI2ThpnQ,2023-07-05T20:56:37Z,sports,https://i.ytimg.com/vi/YzVTI2ThpnQ/maxresdefault.jpg
345,"AFC Asian Cup, World Cup 2026 Qualifiers at SIGHT- What's next for Blue Tigers? - InsideSport",After winning SAFF Championship 2023 Sunil Chhetri-led Indian Football Team set sights of AFC Asian Cup 2023 & World Cup 2026 Qualifiers,https://www.insidesport.in/afc-asian-cup-2023-world-cup-2026-qualifiers-at-sight-what-is-next-for-indian-football-team/,2023-07-05T19:55:18Z,sports,https://www.insidesport.in/wp-content/uploads/2023/07/48150-indian-football-team.webp
346,World Cup Qualifiers: Bleak future beyond the dreams - The New Indian Express,"While one of Netherlands and Scotland are set to book their ticket to India, the next four-year ODI WC gives very little hope for them and other other associate members",https://www.newindianexpress.com/sport/cricket/2023/jul/06/world-cup-qualifiers-bleak-future-beyond-the-dreams-2591746.html,2023-07-05T19:09:00Z,sports,https://images.newindianexpress.com/uploads/user/imagelibrary/2023/7/6/w600X390/Netherlands_-_ICC_1.jpg
347,"Ba11sy Trichy vs Nellai Royal Kings, 28th Match, Tamil Nadu Premier League 2023 - Cricbuzz","Follow Ba11sy Trichy vs Nellai Royal Kings, 28th Match, Jul 05, Tamil Nadu Premier League 2023 with live Cricket score, ball by ball commentary updates on Cricbuzz",https://www.cricbuzz.com/cricket-commentary/68987/trichy-vs-nrk-28th-match-tamil-nadu-premier-league-2023,2023-07-05T18:54:58Z,sports,
348,"On eve of Smith's 100 Test, Siddle takes a walk down memory lane - Rediff.com",Australian pacer Peter Siddle reminisced about his famous partnership with Steve Smith in 2019 at Edgbaston against England in the Ashes series ahead of Smith's 100th Test appearance.,https://www.rediff.com/cricket/report/on-eve-of-smiths-100-test-siddle-takes-a-walk-down-memory-lane/20230706.htm,2023-07-05T18:42:22Z,sports,https://im.rediff.com/cricket/2023/jul/05steve-smith.jpg
349,'Exciting' Shubman Gill Introduced To West Indies Legend Sir Garfield Sobers By India Coach Rahul Dr.. - NDTV Sports,"Members of the Indian cricket team, currently touring the West Indies, met the legendary Sir Garfield Sobers and shared pleasantries with one of the all-time greats of the sport in Barbados",https://sports.ndtv.com/west-indies-vs-india-2023/exciting-shubman-gill-introduced-to-west-indies-legend-sir-garfield-sobers-by-india-coach-rahul-dravid-then-this-happened-watch-4180336,2023-07-05T17:13:00Z,sports,https://c.ndtvimg.com/2023-07/7lophpc8_gill-sobers_625x300_05_July_23.jpg
350,‘I enjoy defending so much!’ - Inigo Martinez talks Barcelona move - Barca Blaugranes,Hear from the club’s latest signing,https://www.barcablaugranes.com/2023/7/5/23784183/i-enjoy-defending-so-much-inigo-martinez-talks-barcelona-move,2023-07-05T17:00:00Z,sports,https://cdn.vox-cdn.com/thumbor/bMKBDBxgTR4JsxEMC3hlVTbAtiI=/0x0:4000x2094/fit-in/1200x630/cdn.vox-cdn.com/uploads/chorus_asset/file/24770636/1479832524.jpg
351,Ashes: 'England playing CazBall not Bazball' - Rediff.com,Legendary pacer Glenn McGrath has slammed England for playing casual cricket against Australia in the ongoing Ashes.,https://www.rediff.com/cricket/report/ashes-england-playing-cazball-not-bazball/20230705.htm,2023-07-05T16:57:08Z,sports,https://im.rediff.com/cricket/2023/jul/05eng-training.jpg
352,"Near-misses behind them, 'Flawless' Australia look to make Ashes history - ESPNcricinfo",Pat Cummins has the chance to go where no Australian captain has gone in 22 years by sealing the series this week,https://www.espncricinfo.com/story/all-things-said-and-done-australia-can-well-win-the-ashes-this-week-1385935,2023-07-05T16:34:00Z,sports,https://img1.hscicdn.com/image/upload/f_auto/lsci/db/PICTURES/CMS/363200/363263.6.jpg
353,Former Indian Cricketer Praveen Kumar in his Land Rover Defender survives crash with a truck - CarToq.com,"Former Indian cricketer Praveen Kumar had a narrow escape from a potentially disastrous accident in Meerut city, Uttar Pradesh. The incident occurred on Tuesday when Praveen was driving his Land Rover Defender luxury SUV accompanied by his son. Their vehicle …",https://www.cartoq.com/former-indian-cricketer-praveen-kumar-in-his-land-rover-defender-survives-crash-with-a-truck/,2023-07-05T16:07:19Z,sports,https://www.cartoq.com/wp-content/uploads/2023/07/praveen-kumar-land-rover-defender-crash-featured.jpg
354,Will Ajit Agarkar take tough calls? | How good is India's A squad? | Sports News | News9 - NEWS9 Live,"As Indian Cricket enters a new phase of transition, how important will new Chairman of selectors, Ajit Agarkar's role be in creating a successful succession ...",https://www.youtube.com/watch?v=_vmwaPdzKt0,2023-07-05T15:08:59Z,sports,https://i.ytimg.com/vi/_vmwaPdzKt0/maxresdefault.jpg
355,"Highlights | WI vs OMAN, ODI World Cup Qualifiers 2023, Super Sixes Cricket Scorecard: West Indies W - Zee News","Highlights | WI vs OMAN, ODI World Cup Qualifiers 2023, Super Sixes Cricket Scorecard: West Indies W",https://zeenews.india.com/cricket/live-updates/highlights-oma-vs-wi-icc-odi-world-cup-qualifiers-2023-super-sixes-match-7-today-oman-vs-west-indies-cwc-2023-qualifiers-harare-sports-club-harare-aqib-ilyas-shai-hope-222-runs-2nd-innings-target-for-wi-2630791,2023-07-05T14:59:45Z,sports,https://english.cdn.zeenews.com/sites/default/files/2023/07/04/1233788-whatsapp-image-2023-07-04-at-12.24.49-pm.jpeg
356,Chelsea looking to add Mbappe alongside Nkunku to Ignite their Attack - Six Sports India,"Chelsea fans have been buzzing with anticipation as the club’s transfer activity intensifies. While the departure of key players has left gaps in the squad, the arrival of Christopher Nkunku has injected fresh hope into Stamford Bridge. But could there be an …",https://sixsports.in/mbappe-and-nkunku-the-dynamic-duo-ready-to-ignite-chelseas-attack/,2023-07-05T13:39:02Z,sports,https://sixsports.in/wp-content/uploads/2023/01/chelsea-logo-1000x600.jpg
