,Title,Description,URL,Published At,Category,Image URL
95,"Aquarius Horoscope Today: July 6, 2023 - VOGUE India","Read VOGUE India's free daily Aquarius horoscope for 6th July, 2023 to learn more about what the stars have in store for you! Click here for our cosmic tips",https://www.vogue.in/horoscope/product/aquarius-horoscope-today-july-6-2023/,2023-07-06T00:20:07Z,entertainment,https://media.vogue.in/wp-content/uploads/2021/12/Aquarius-866x487.jpg
96,Monstrous teaser of Prabhas’ Salaar released - 123telugu,"Telugu cinema news, Telugu Movies Updates, Latest Movie reviews in Telugu, Telugu cinema reviews, telugu movie reviews, Tollywood, Box office collections, Telugu Movie show times, Theater List, telugu cinema tickets",https://www.123telugu.com/mnews/monstrous-teaser-of-prabhas-salaar-released.html,2023-07-05T23:55:00Z,entertainment,https://www.123telugu.com/content/wp-content/themes/123telugu/images/logo.gif
97,Hong Kong-born singer Coco Lee dies after suicide attempt - ANI News,"Her sisters Carol and Nancy said Lee was suffering from depression for ""a few years"" and attempted to take her own life on Sunday",https://www.aninews.in/news/world/asia/hong-kong-born-singer-coco-lee-dies-after-suicide-attempt20230706044327,2023-07-05T23:13:00Z,entertainment,https://d3lzcn6mbbadaf.cloudfront.net/media/details/ANI-20230705231314.jpg
98,"Richa Chadha: If I hadn't met Ali Fazal, I probably wouldn't have gotten married at all - Indiatimes.com",Richa Chadha recently spoke about her marriage with Ali Fazal and opened up about the kind of equation they share with each other as husband and wife.,https://timesofindia.indiatimes.com/entertainment/hindi/bollywood/news/richa-chadha-if-i-hadnt-met-ali-fazal-i-probably-wouldnt-have-gotten-married-at-all/articleshow/101525247.cms,2023-07-05T21:16:00Z,entertainment,"https://static.toiimg.com/thumb/msid-101525246,width-1070,height-580,imgsize-41182,resizemode-75,overlay-toi_sw,pt-32,y_pad-40/photo.jpg"
99,Mission: Impossible 7 gets highest Rotten Tomatoes score of franchise - Digital Spy,It's another critical hit for Tom Cruise.,https://www.digitalspy.com/movies/a44450807/mission-impossible-7-rotten-tomatoes-score/,2023-07-05T21:02:31Z,entertainment,"https://hips.hearstapps.com/hmg-prod/images/tom-cruise-mission-impossible-dead-reckoning-part-one-6464a8047d24b.jpg?crop=0.597xw:0.449xh;0.0934xw,0.185xh&resize=1200:*"
100,"Vijay Varma kickstarts dubbing for Mirzapur 3, says, 'Pirpared rahiye' - Indiatimes.com",News News: Vijay Varma recently took to his social media to drop a major update on his much awaited web series Mirzapur 3.,https://timesofindia.indiatimes.com/web-series/news/hindi/vijay-varma-kickstarts-dubbing-for-mirzapur-3-says-pirpared-rahiye/articleshow/101525012.cms,2023-07-05T20:09:00Z,entertainment,"https://static.toiimg.com/thumb/msid-101525007,width-1070,height-580,imgsize-43736,resizemode-75,overlay-toi_sw,pt-32,y_pad-40/photo.jpg"
101,Birthday special: Ranveer Singh's adorable moments with Deepika Padukone - Indiatimes.com,"Ranveer Singh, the most versatile actor in Bollywood today, has a knack for delivering performances that break records. The actor plays every role wit",https://timesofindia.indiatimes.com/entertainment/hindi/bollywood/news/birthday-special-ranveer-singhs-adorable-moments-with-deepika-padukone/articleshow/101524760.cms,2023-07-05T19:09:00Z,entertainment,"https://static.toiimg.com/thumb/msid-101524781,width-1070,height-580,imgsize-35812,resizemode-75,overlay-toi_sw,pt-32,y_pad-40/photo.jpg"
102,"#CelebrityEvenings: From Parineeti Chopra to Shamita Shetty, Bollywood celebs spotted in Mumbai - Indiatimes.com","The paparazzi captured Bollywood stars at different locations in Mumbai on July 5. Celebrities including Kartik Aaryan, Gajraj Rao, Natasa Stankovic, Shah Rukh Khan's son Aaryan Khan, Mahira Sharma, Ayushmann Khurrana, Rochak Kohli, Shalin Bhanot, an",https://timesofindia.indiatimes.com/videos/etimes/bollywood/celebrityevenings-from-natasa-stankovic-to-mahira-sharma-b-town-stars-spotted-in-mumbai/videoshow/101524552.cms,2023-07-05T18:36:29Z,entertainment,https://timesofindia.indiatimes.com/photo/101524552/size-58984/101524552.jpg
103,OTT Releases this week: From 'Adhura' to 'Tarla' and 'Blind' among others to look forward to - India Forums,The list goes from Prime Video's Adhura to Blind featuring Sonam Kapoor to Tarla starring Huma Qureshi and much more.,https://www.indiaforums.com/article/ott-releases-this-week-from-adhura-to-tarla-and-blind-among-others-to-look-forward-to_198253,2023-07-05T18:30:00Z,entertainment,https://img.indiaforums.com/article/1200x675/19/8253-ott-releases-this-week-from-adhura-to-tarla-and-blind-among-others-to-look-forward-to.jpg?c=6cKDC7
104,"Vidya Balan, Anil Kapoor, Javed Akhtar and other Bollywood celebs watch Neeyat at a special screening - Indiatimes.com","The special screening of Neeyat was attended by a slew of celebs such as Javed Akhtar, Anil Kapoor, Vidya Balan, Fatima Sana Shaikh, Karishma Tanna, A",https://timesofindia.indiatimes.com/entertainment/hindi/bollywood/news/vidya-balan-anil-kapoor-javed-akhtar-and-other-bollywood-celebs-watch-neeyat-at-a-special-screening/articleshow/101523855.cms,2023-07-05T17:45:00Z,entertainment,"https://static.toiimg.com/thumb/msid-101523898,width-1070,height-580,imgsize-100876,resizemode-75,overlay-toi_sw,pt-32,y_pad-40/photo.jpg"
105,Carry On Jatta 3 Full Movie In HD (Free Download) Leaked Online - Lehren,Gippy Grewal and Sonam Bajwa starrer Carry On Jatta 3 full movie has been leaked online on Telegram and other torrent websites.,https://lehren.com/featured/carry-on-jatta-3-full-movie-hd-free-download-leaked-online/172322/,2023-07-05T17:34:09Z,entertainment,https://lehren.com/wp-content/uploads/2023/07/carry-on-jatta-3-full-movie-leaked.jpg
106,Teri Meri Doriyaann 6th July 2023 Written Update: Garry plants evidence to frame Sahiba - Justshowbiz,,https://www.justshowbiz.net/teri-meri-doriyaann-6th-july-2023-written-update/,2023-07-05T17:14:00Z,entertainment,
107,Police complaint filed in Mumbai against makers of Hindi film '72 Hoorain' - mid-day.com,"According to the official, the complaint was filed at the Goregaon police station in suburban Mumbai.",https://www.mid-day.com/mumbai/mumbai-news/article/police-complaint-filed-in-mumbai-against-makers-of-hindi-film-72-hoorain-23296151,2023-07-05T17:09:00Z,entertainment,https://images.mid-day.com/images/images/2023/jul/72hoorain_d.jpg
108,Imlie 6th July 2023 Written Update: Kairi brings Arto and Imlie closer - Justshowbiz,,https://www.justshowbiz.net/imlie-6th-july-2023-written-update/,2023-07-05T16:56:00Z,entertainment,
109,"Ghum Hai Kisikey Pyaar Meiin: Intense! Isha and Ishaan's past revealed, finally mother and son face each other - Tellychakkar",Savi is with Ishaan in his car while Reeva is in the college where she misses Ishaan as someone plays Ishaan 's assembly speech on their phone. She sees two girls listening to the speech on their phone like fan girls and admiring the voice. Reeva watches them…,https://www.tellychakkar.com/spoiler-alert/ghum-hai-kisikey-pyaar-meiin-intense-isha-and-ishaan-s-past-revealed-finally-mother,2023-07-05T16:12:00Z,entertainment,https://d30ny7ijak9wq4.cloudfront.net/s3fs-public/images/spoiler-alert/2023/07/05/ish.jpg
110,Rekha on film hiatus: 'I choose where I want to be and where I don’t want to be' - mid-day.com,"In a groundbreaking interview, her first in nearly two decades, Rekha opened up about her absence from the silver screen.",https://www.mid-day.com/entertainment/bollywood-news/article/rekha-on-film-hiatus-i-choose-where-i-want-to-be-and-where-i-dont-want-to-be-23296148,2023-07-05T15:44:00Z,entertainment,https://images.mid-day.com/images/images/2023/jul/RekhaV_d.jpg
111,Arjun Dasyan – Sri Simha Koduri is the right choice for Bhaag Saale - 123telugu,"Telugu cinema news, Telugu Movies Updates, Latest Movie reviews in Telugu, Telugu cinema reviews, telugu movie reviews, Tollywood, Box office collections, Telugu Movie show times, Theater List, telugu cinema tickets",https://www.123telugu.com/mnews/arjun-dasyan-sri-simha-koduri-is-the-right-choice-for-bhaag-saale.html,2023-07-05T15:30:00Z,entertainment,https://www.123telugu.com/content/wp-content/themes/123telugu/images/logo.gif
112,Australian Chef Gary Mehigan Seeks Consent Before Kissing Huma Qureshi. Netizens Say ‘Aise Kisi Fan Ne…’ - Times Now,"Australian chef Gary Mehigan met Huma Qureshi ahead of Tarla's release. He kissed the actress on her cheeks, but notably, she sought consent from her before doing it. Read full story to know more-",https://www.timesnownews.com/entertainment-news/australian-chef-gary-mehigan-seeks-consent-before-kissing-huma-qureshi-netizens-say-aise-kisi-fan-ne-article-101521673,2023-07-05T14:42:54Z,entertainment,"https://static.tnn.in/thumb/msid-101521673,updatedat-1688568174550,width-1280,height-720,resizemode-75/101521673.jpg"
113,"Adivi Sesh reviews Kartik Aaryan, Kiara Advani starrer Satyaprem Ki Katha; calls it ‘a remarkable film’ - Bollywood Hungama","Adivi Sesh reviews Kartik Aaryan, Kiara Advani starrer Satyaprem Ki Katha; calls it ‘a remarkable film’ Bollywood News: Latest Bollywood News, Bollywood News Today, Bollywood Celebrity News, Breaking News, Celeb News, Celebrities News, Bollywood News Hindi, H…",https://www.bollywoodhungama.com/news/features/adivi-sesh-reviews-kartik-aaryan-kiara-advani-starrer-satyaprem-ki-katha-calls-remarkable-film/,2023-07-05T14:32:13Z,entertainment,https://stat4.bollywoodhungama.in/wp-content/uploads/2023/07/Adivi-Sesh-reviews-Kartik-Aaryan-Kiara-Advani-starrer-Satyaprem-Ki-620.jpg
114,See how new mom Sana Khan welcomed hubby Anas post his Haj - The Siasat Daily,"Mumbai: Former actress Sana Khan has been blessed with a baby boy. She welcomed her first child on Thursday, July 5. Her husband Mufti Anas Saiyad, who went to Saudi Arabia to perform Haj this year, came back to Mumbai today, soon after which Sana announced t…",https://www.siasat.com/see-how-new-mom-sana-khan-welcomed-hubby-anas-post-his-haj-2632293/,2023-07-05T13:45:00Z,entertainment,https://cdn.siasat.com/wp-content/uploads/2023/01/sana-khan.jpg
115,Kareena Kapoor's 'virtual meeting background' will make you pack your bags and go for a workation: Pic in - Indiatimes.com,"Kareena Kapoor has been dropping stunning pics from her holiday in Europe, where she is enjoying with husband Saif Ali Khan and kids Taimur and Jeh. E",https://timesofindia.indiatimes.com/entertainment/hindi/bollywood/news/kareena-kapoors-virtual-meeting-background-will-make-you-pack-your-bags-and-go-for-a-workation/articleshow/101519738.cms,2023-07-05T12:39:00Z,entertainment,"https://static.toiimg.com/thumb/msid-101519676,width-1070,height-580,imgsize-116137,resizemode-75,overlay-toi_sw,pt-32,y_pad-40/photo.jpg"
116,Kajol shares her views on plastic surgery: 'God has made you in a particular way…' - Indiatimes.com,"Kajol has always managed to impress the audiences with her extra-ordinary acting performances in films. The actor is also known for not holding back and always speaking her mind unabashedly. In a recent interview, Kajol was asked what advice she woul",https://timesofindia.indiatimes.com/videos/etimes/bollywood/kajol-shares-her-views-on-plastic-surgery-god-has-made-you-in-a-particular-way/videoshow/101519143.cms,2023-07-05T12:31:00Z,entertainment,https://timesofindia.indiatimes.com/photo/101519143/size-67064/101519143.jpg
117,Zeenat Aman reminisces about Chhailla Babu shoot with nostalgic Instagram post - Bollywood Hungama,"Zeenat Aman reminisces about Chhailla Babu shoot with nostalgic Instagram post Bollywood News: Latest Bollywood News, Bollywood News Today, Bollywood Celebrity News, Breaking News, Celeb News, Celebrities News, Bollywood News Hindi, Hindi Bollywood News at Bo…",https://www.bollywoodhungama.com/news/features/zeenat-aman-reminisces-chhailla-babu-shoot-nostalgic-instagram-post/,2023-07-05T12:01:27Z,entertainment,https://stat4.bollywoodhungama.in/wp-content/uploads/2023/07/Zeenat-Feature-1.jpg
118,"Nikhil apologises to Pan-India viewers, what about Telugu viewers? - Deccan Chronicle","Nikhil apologises to Pan-India viewers, what about Telugu viewers?",https://www.deccanchronicle.com/entertainment/tollywood/050723/nikhil-apologises-to-pan-india-viewers-what-about-telugu-viewers.html,2023-07-05T11:07:52Z,entertainment,https://s3.ap-southeast-1.amazonaws.com/images.deccanchronicle.com/dc-Cover-bamrg5tupsjso6pi3v7tma9rv7-20230705163247.Medi.jpeg
119,SCOOP: Shraddha Kapoor to play lead in Kartik Aaryan starrer Chandu Champion? - Bollywood Hungama,"SCOOP: Shraddha Kapoor to play lead in Kartik Aaryan starrer Chandu Champion?. Bollywood News: Latest Bollywood News, Bollywood News Today, Bollywood Celebrity News, Breaking News, Celeb News, Celebrities News, Bollywood News Hindi, Hindi Bollywood News at Bo…",https://www.bollywoodhungama.com/news/bollywood/scoop-shraddha-kapoor-play-lead-kartik-aaryan-starrer-chandu-champion/,2023-07-05T11:00:50Z,entertainment,https://stat5.bollywoodhungama.in/wp-content/uploads/2023/07/SCOOP-Shraddha-Kapoor-to-play-lead-in-Kartik-Aaryan-starrer-Chandu-Champion-2.jpg
120,Will Yuvika be able to prove her capability as she strikes an important deal at the Mahajan office in Vanshaj? - India Forums,Sony Sab's show Vanshaj has posed an important questions for the viewers of the show.,https://www.indiaforums.com/article/will-yuvika-be-able-to-prove-her-capability-as-she-strikes-an-important-deal-at-the-mahajan-office-i_198244,2023-07-05T10:24:00Z,entertainment,https://img.indiaforums.com/article/1200x675/19/8244-will-yuvika-be-able-to-prove-her-capability-as-she-strikes-an-important-deal-at-the-mahajan-office-i.jpg
121,Kya Baat Hai! Neil Bhatt's emotional reunion with wife Aishwarya Sharma will melt your heart - Tellychakkar,"Neil and Aishwarya are one of the most loved couples on television and they have a massive fan following. Today, Aishwarya Sharma returned from South Africa after shooting for the new season of Khatron Ke Khiladi and Neil was at the airport to receive her.",https://www.tellychakkar.com/tv/tv-news/kya-baat-hai-neil-bhatts-emotional-reunion-wife-aishwarya-sharma-will-melt-your-heart,2023-07-05T10:08:00Z,entertainment,https://d30ny7ijak9wq4.cloudfront.net/s3fs-public/images/story/2023/07/05/neil_.jpg
122,Adipurush box office collection Week 3: Prabhas starrer to end box office run with a collection of Rs 128 - Indiatimes.com,The Prabhas and Kriti Sanon starrer Adipurush will soon end its box office run this week with a total collection of just around Rs 128.50 crore. This,https://timesofindia.indiatimes.com/entertainment/hindi/bollywood/box-office/adipurush-box-office-collection-week-3-prabhas-starrer-to-end-box-office-run-with-a-collection-of-rs-128-50-crore/articleshow/101513547.cms,2023-07-05T09:53:00Z,entertainment,"https://static.toiimg.com/thumb/msid-101513469,width-1070,height-580,imgsize-66460,resizemode-75,overlay-toi_sw,pt-32,y_pad-40/photo.jpg"
123,Lyca Productions announces a new film with 2018 director - 123telugu,"Telugu cinema news, Telugu Movies Updates, Latest Movie reviews in Telugu, Telugu cinema reviews, telugu movie reviews, Tollywood, Box office collections, Telugu Movie show times, Theater List, telugu cinema tickets",https://www.123telugu.com/mnews/lyca-productions-announces-a-new-film-with-2018-director.html,2023-07-05T09:30:00Z,entertainment,https://www.123telugu.com/content/wp-content/themes/123telugu/images/logo.gif
124,Chiranjeevi's niece Niharika Konidela and Chaitanya Jonnalagadda confirm divorce | Onmanorama - Onmanorama,"In her heartfelt message, Niharika expressed gratitude towards her supportive family and friends during this challenging time.",https://www.onmanorama.com/entertainment/entertainment-news/2023/07/05/chiranjeevi-niece-actress-niharika-konidela-husband-chaitanya-jonnalagadda-divorce.html,2023-07-05T09:24:30Z,entertainment,https://img.onmanorama.com/content/dam/mm/en/entertainment/entertainment-news/images/2023/7/5/niharika-chaitanya.jpg
125,Alia Bhatt’s Bengali role in ‘Rocky Aur Rani Kii Prem Kahaani’ sparks fan war with Deepika Padukone’s ‘Piku’ lovers - Indiatimes.com,"Alia Bhatt-Ranveer Singh starrer ‘Rocky Aur Rani Kii Prem Kahaani’ has been the talk of the town ever since the makers have released the song ‘Tum Kya Mile’. And when recently, the trailer of the much-anticipated film dropped on the internet, several",https://timesofindia.indiatimes.com/videos/etimes/bollywood/alia-bhatts-bengali-role-in-rocky-aur-rani-kii-prem-kahaani-sparks-fan-war-with-deepika-padukones-piku-lovers/videoshow/101511891.cms,2023-07-05T08:43:28Z,entertainment,https://timesofindia.indiatimes.com/photo/101511891/size-61664/101511891.jpg
126,Vikram and Malavika Mohanan recreate Arjun Ashokan's famous head nod in 'Thangalaan' pack-up video | Onmanorama - Onmanorama,The film is set in the British Era and is based on an incident that happened at the KGF.,https://www.onmanorama.com/entertainment/entertainment-news/2023/07/05/thangalaan-movie-vikram-malavika-mohanan-romancham-arjun-ashokan.html,2023-07-05T08:35:11Z,entertainment,https://img.onmanorama.com/content/dam/mm/en/entertainment/entertainment-news/images/2023/7/5/thangalaan-packup.jpg
127,Shah Rukh Khan seen in Mumbai airport after reports of accident in the USA - The News Minute,Bollywood superstar Shah Rukh Khan (SRK) has come back to India and was spotted in the Mumbai airport after reports of his accident in the US started doing the rounds on the Internet. Celebrity paparazzi Viral Bhayani shared a video of Shah Rukh exiting the a…,https://www.thenewsminute.com/article/shah-rukh-khan-seen-mumbai-airport-after-reports-accident-usa-179359,2023-07-05T07:14:40Z,entertainment,https://www.thenewsminute.com/sites/default/files/ShahRukhKhan_101021_1200x800_PTI.jpg
128,"Ameesha Patel says she 'still stands by what she said about Bipasha Basu's Jism': 'I think it takes guts to be there, be bold physically...' - Times of India","Ameesha Patel had once targeted Bipasha Basu for her role in 'Jism' and said that she couldn't be that bold. Later replying to it, Bipasha said 'Ameesha was too petite, too small to carry, her whole frame is wrong. And all this happened on Karan Joha",https://timesofindia.indiatimes.com/videos/etimes/bollywood/ameesha-patel-says-she-still-stands-by-what-she-said-about-bipasha-basus-jism-i-think-it-takes-guts-to-be-there-be-bold-physically-/videoshow/101508670.cms,2023-07-05T07:04:59Z,entertainment,https://timesofindia.indiatimes.com/photo/101508670/size-65400/101508670.jpg
129,"Viral video: Priyanka Chopra lambasted for saying Indian movies are about 'hips, bo*bs' - The Tribune India",,https://www.tribuneindia.com/news/trending/viral-video-priyanka-chopra-lambasted-for-saying-indian-movies-are-about-hips-bobs-522991,2023-07-05T06:23:00Z,entertainment,
130,25 Years of Satya: Apurva Asrani reveals how he captured footage in Worli secretly - Bollywood Hungama,"25 Years of Satya: Apurva Asrani reveals how he captured footage in Worli secretly Bollywood News: Latest Bollywood News, Bollywood News Today, Bollywood Celebrity News, Breaking News, Celeb News, Celebrities News, Bollywood News Hindi, Hindi Bollywood News a…",https://www.bollywoodhungama.com/news/features/25-years-satya-apurva-asrani-reveals-captured-footage-worli-secretly/,2023-07-05T05:23:51Z,entertainment,https://media5.bollywoodhungama.in/wp-content/uploads/2023/07/25-Years-of-Satya-Apurva-Asrani-reveals-how-he-captured-footage-in-Worli-secretly.jpg
131,Varun Tej’s #VT13 Arriving In December - Gulte,"Mega prince Varun Tej is venturing into Bollywood with his 13th film being directed by well-known ad filmmaker Shakti Pratap Singh. This is a patriotic, edge-of-the-seat entertainer and will showcase the indomitable spirits of our heroes on the frontlines and…",https://www.gulte.com/movienews/248412/varun-tejs-vt13-arriving-in-december,2023-07-05T04:25:58Z,entertainment,https://cdn.gulte.com/wp-content/uploads/2023/07/WhatsApp-Image-2023-07-05-at-9.49.13-AM-660x330.jpeg
132,Samantha Ruth Prabhu to take a year-long break from acting after ‘Citadel' - Indiatimes.com,A year ago Samantha Ruth Prabhu had revealed that she has been diagnosed with an auto-immune condition called Myositis. The actress has been undergoin,https://timesofindia.indiatimes.com/entertainment/hindi/bollywood/news/samantha-ruth-prabhu-to-take-a-year-long-break-from-acting-after-citadel-report/articleshow/101503559.cms,2023-07-05T04:25:00Z,entertainment,"https://static.toiimg.com/thumb/msid-101503721,width-1070,height-580,imgsize-31300,resizemode-75,overlay-toi_sw,pt-32,y_pad-40/photo.jpg"
133,Rani Mukerji’s old video of denying dating Aditya Chopra SHOCKS netizens – ‘Some actors are always acting’ - Indiatimes.com,"Rani Mukerji has been married to Aditya Chopra since 2014 and the two are doting parents to their daughter Adira. Recently, an old interview of the actress with a news channel surfaced on the internet wherein she can be seen denying being romanticall",https://timesofindia.indiatimes.com/videos/etimes/bollywood/rani-mukerjis-old-video-of-denying-dating-aditya-chopra-shocks-netizens-some-actors-are-always-acting/videoshow/101501214.cms,2023-07-05T02:59:13Z,entertainment,https://timesofindia.indiatimes.com/photo/101501214/size-44470/101501214.jpg
134,"Rakhi Sawant on Akanksha Puri, Jad Hadid kiss controversy on 'Bigg Boss OTT 2': 'Kissing is not a crime' - Indiatimes.com",Social media sensation Rakhi Sawant is known for her unfiltered statements and fearless attitude. The actress recently got papped in the city where she reacted to the Akanksha Puri-Jad Hadid kiss controversy on 'Bigg Boss OTT 2'. While extending her,https://timesofindia.indiatimes.com/videos/entertainment/hindi/rakhi-sawant-on-akanksha-puri-jad-hadid-kiss-controversy-on-bigg-boss-ott-2-kissing-is-not-a-crime/videoshow/101495836.cms,2023-07-04T18:21:43Z,entertainment,https://timesofindia.indiatimes.com/photo/101495836/size-47210/101495836.jpg
135,Diana Penty slays in a plunge-neck bustier and jeans at Paris Fashion Week - Indiatimes.com,"Diana Penty recently graced the ongoing Paris Couture Week. Taking to her Instagram handle, the 'Cocktail' actress shared a bunch of snaps and a video wherein she can be seen flaunting her look for the fashion event. She could be seen posing for the",https://timesofindia.indiatimes.com/videos/entertainment/hindi/diana-penty-slays-in-a-plunge-neck-bustier-and-jeans-at-paris-fashion-week/videoshow/101495265.cms,2023-07-04T17:50:00Z,entertainment,https://timesofindia.indiatimes.com/photo/101495265/size-92990/101495265.jpg
136,Movies and series releasing this week in theatres and OTT - 123telugu,"Telugu cinema news, Telugu Movies Updates, Latest Movie reviews in Telugu, Telugu cinema reviews, telugu movie reviews, Tollywood, Box office collections, Telugu Movie show times, Theater List, telugu cinema tickets",https://www.123telugu.com/mnews/movies-and-series-releasing-this-week-in-theatres-and-ott-43.html,2023-07-04T16:30:00Z,entertainment,https://www.123telugu.com/content/wp-content/themes/123telugu/images/logo.gif
137,From wearing her wedding saree on stage to patching up with Akhil Marar; Here's how Sobha Viswanath won h - Times of India,Finalist Sobha Viswanath has won million of hearts in the Bigg Boss Malayalam 5 stage. She was spotted wearing her wedding saree in the finale stage.,https://timesofindia.indiatimes.com/tv/news/malayalam/from-wearing-her-wedding-saree-on-stage-to-patching-up-with-akhil-marar-heres-how-sobha-viswanath-won-hearts-in-bigg-boss-malayalam-5-finale/articleshow/101491253.cms,2023-07-04T13:01:00Z,entertainment,"https://static.toiimg.com/thumb/msid-101491253,width-1070,height-580,imgsize-46846,resizemode-75,overlay-toi_sw,pt-32,y_pad-40/photo.jpg"
138,'What they have done is shameful': Vindu Dara Singh lambasts 'Adipurush' makers for trying to distort his father's legacy as Lord Hanuman - Times of India,"Amid controversies surrounding 'Adipurush', now Vindu Dara Singh, who played Lord Hanuman in TV shows, slammed the makers of the film for treating the subject in a lousy way. Late Dara Singh, father of Vindu, played the role of Lord Hanuman in the Ra",https://timesofindia.indiatimes.com/videos/etimes/bollywood/what-they-have-done-is-shameful-vindu-dara-singh-lambasts-adipurush-makers-for-trying-to-distort-his-fathers-legacy-as-lord-hanuman/videoshow/101490013.cms,2023-07-04T12:12:51Z,entertainment,https://timesofindia.indiatimes.com/photo/101490013/size-59172/101490013.jpg
139,‘Maamannan’ Kerala box office: Mari Selvaraj’s political thriller mints Rs 1.50 crores in the opening wee - Indiatimes.com,"Renowned Tamil director Mari Selvaraj continues to mesmerize audiences with his distinctive storytelling style, delving deep into societal issues. His",https://timesofindia.indiatimes.com/entertainment/malayalam/movies/box-office/maamannan-kerala-box-office-mari-selvarajs-political-thriller-mints-rs-1-50-crores-in-the-opening-weekend/articleshow/101486926.cms,2023-07-04T10:44:00Z,entertainment,"https://static.toiimg.com/thumb/msid-101486953,width-1070,height-580,imgsize-38696,resizemode-75,overlay-toi_sw,pt-32,y_pad-40/photo.jpg"
140,Hyderabad: Four-legged friends get the shot - Telangana Today,A renowned French biologist who administered the inaugural rabies vaccine on the same day in 1885.,https://telanganatoday.com/hyderabad-four-legged-friends-get-the-shot,2023-07-06T10:33:08Z,general,https://cdn.telanganatoday.com/wp-content/uploads/2023/07/Hyderabad-Four-legged-friends-get-the-shot-1.jpg
